{
  "$schema": "./menuPermissionsSchema.json",
  "version": "2.0.0",
  "description": "Единая централизованная конфигурация древовидного бокового меню (Sidebar), прав доступа (RBAC) и экранных элементов МИС «ОртоERP». Значение ['*'] разрешает доступ всем авторизованным пользователям. Массив прав ['sysadmin', 'doctor'] реализует мульти-доступ.",
  "rolesAndPermissions": [
    { "code": "sysadmin", "name": "Системный администратор", "description": "Полный системный доступ ко всем модулям и настройкам" },
    { "code": "administrator", "name": "Администратор клиники", "description": "Оформление визитов, расписание, прейскурант, персонал" },
    { "code": "doctor", "name": "Врач травматолог-ортопед", "description": "АРМ врача, 2D-гомункулус, тесты, протоколы, направления" },
    { "code": "nurse", "name": "Медицинская сестра", "description": "Процедурный кабинет, расписание, списание расходных материалов" },
    { "code": "accountant", "name": "Бухгалтер / Экономист", "description": "Кассовые смены, выплаты персоналу, аудит ККТ, прейскурант" },
    { "code": "default", "name": "Базовый доступ", "description": "Базовый просмотр справочников, дашборда и руководства" }
  ],
  "menuGroups": [
    {
      "id": "operations_and_wizards",
      "title": "Сервисы",
      "icon": "AutoAwesomeMotion",
      "defaultOpen": false,
      "tooltip": "Клинические процессы: АРМ врача-ортопеда, реестры протоколов и направлений, шаблоны 2.0 и руководство",
      "permissions": ["*"],
      "items": [
        {
          "id": "ortho_workstation",
          "text": "АРМ врача-ортопеда",
          "path": "/ortho-workstation",
          "icon": "MedicalServices",
          "iconColor": "#0F3C64",
          "tooltip": "Рабочее место травматолога-ортопеда: интерактивный 2D-гомункулус, углометрия Neutral-0 ROM, клинические тесты, медиатека снимков и live-протокол (PDF/DOCX/RTF/TXT)",
          "permissions": ["sysadmin", "doctor"]
        },
        {
          "id": "protocols_registry",
          "text": "Реестр Протоколов и направлений пациентов",
          "path": "/protocols-registry",
          "icon": "Description",
          "iconColor": "#0F3C64",
          "tooltip": "Реестр Протоколов и направлений пациентов: полнотекстовый поиск FTS5 по историческим записям, разграничение доступа RBAC (323-ФЗ), аудит Serilog, пакетная печать и контроль направлений",
          "permissions": ["sysadmin", "doctor", "administrator"]
        },
        {
          "id": "patient_referrals",
          "text": "Направления пациентов",
          "path": "/patient-referrals",
          "icon": "Assignment",
          "iconColor": "#0F3C64",
          "tooltip": "Реестр направлений Центра Ортопедии Добрушкина: внутренние кабинеты и внешние центры, контроль 90-дневного срока действия, печать и экспорт Word",
          "permissions": ["sysadmin", "doctor", "administrator"]
        },
        {
          "id": "ortho_templates_manager",
          "text": "Справочник шаблонов 2.0",
          "path": "/ortho-templates-manager",
          "icon": "Science",
          "iconColor": "#0F3C64",
          "tooltip": "Справочник 180 клинических шаблонов, 1 377 ортопедических тестов, 381 метод аппаратной диагностики и Neutral-0 ROM пресетов",
          "permissions": ["*"]
        },
        {
          "id": "user_guide",
          "text": "Полное Руководство",
          "path": "/user-guide",
          "icon": "MenuBook",
          "iconColor": "#0F3C64",
          "tooltip": "Интерактивное руководство пользователя: описание функционала МИС, справочников, архитектуры данных и пошаговых регламентов расчетов",
          "permissions": ["*"]
        }
      ]
    },
    {
      "id": "scheduling_and_reception",
      "title": "Расписание и прием",
      "icon": "CalendarMonth",
      "defaultOpen": false,
      "tooltip": "Управление потоком пациентов: расписание врачей, календарь приемов и пошаговое оформление визитов",
      "permissions": ["*"],
      "items": [
        {
          "id": "scheduling",
          "text": "Расписание и прием",
          "path": "/scheduling",
          "icon": "Event",
          "tooltip": "Календарь приемов и расписание врачей: планирование слотов по кабинетам, отслеживание визитов, регистрация явки и перенос записей",
          "permissions": ["sysadmin", "administrator", "doctor", "nurse"]
        },
        {
          "id": "checkout",
          "text": "Оформление визита пациента",
          "path": "/checkout",
          "icon": "LocalHospital",
          "tooltip": "Пошаговый мастер оформления визита: выбор пациента и доктора, добавление медицинских услуг, расчет себестоимости и скидок, печать фискального чека ККТ",
          "permissions": ["sysadmin", "administrator", "accountant"]
        }
      ]
    },
    {
      "id": "accounting",
      "title": "Бухгалтерия",
      "icon": "AccountBalanceWallet",
      "defaultOpen": false,
      "tooltip": "Бухгалтерский и финансовый учет: кассовые смены, выплаты персоналу, аудит ККТ, отчетность и документы, склад, технологические карты и параметры расчетов",
      "permissions": ["sysadmin", "accountant", "administrator", "doctor", "nurse"],
      "items": [
        {
          "id": "fiscal_shifts",
          "text": "Журнал и Аналитика смен",
          "path": "/admin/fiscal-shifts",
          "icon": "PointOfSale",
          "iconColor": "#0F3C64",
          "tooltip": "Кассовые смены ККТ АТОЛ 91Ф: открытие и закрытие смен с Z-отчетом, автоматическая мнемоническая нумерация, сверка кассы и X-отчеты",
          "permissions": ["sysadmin", "accountant", "administrator"]
        },
        {
          "id": "staff_payouts",
          "text": "Расчет выплат сотрудникам",
          "path": "/staff-payouts",
          "icon": "AccountBalanceWallet",
          "tooltip": "Расчет и ведомости выплат: автоматический расчет заработной платы врачей и ассистентов на основе выполненных услуг, ставок и нормативов",
          "permissions": ["sysadmin", "accountant"]
        },
        {
          "id": "reports",
          "text": "Отчетность и документы",
          "path": "/reports",
          "icon": "Assessment",
          "tooltip": "Генератор документов и отчетов: формирование сводных справок, протоколов лечения, реестров услуг и экспорт документов в PDF и Excel",
          "permissions": ["sysadmin", "administrator", "accountant", "doctor"]
        },
        {
          "id": "fiscal_audit",
          "text": "Журнал аудита ККТ",
          "path": "/fiscal-audit",
          "icon": "ReceiptLong",
          "tooltip": "Журнал аудита фискальных операций 54-ФЗ: поминутный журнал взаимодействия с ККТ через Serilog, фискальные признаки (ФД/ФП) и статусы чеков",
          "permissions": ["sysadmin", "accountant"]
        },
        {
          "id": "inventory",
          "text": "Склад материалов и медикаментов",
          "path": "/inventory",
          "icon": "Inventory",
          "tooltip": "Учет складских остатков: мониторинг остатков медикаментов, лимиты запасов и автоматическое списание по технологическим картам визитов",
          "permissions": ["sysadmin", "accountant", "nurse", "administrator"]
        },
        {
          "id": "operations",
          "text": "Каталог сервисов и технологических карт",
          "path": "/operations",
          "icon": "LocalHospital",
          "tooltip": "Справочник медицинских услуг: прейскурант клиники, технологические карты BOM, расходные материалы, себестоимость и длительность",
          "permissions": ["sysadmin", "accountant", "administrator"]
        },
        {
          "id": "parameters",
          "text": "Параметры расчетов",
          "path": "/parameters",
          "icon": "Settings",
          "tooltip": "Системные настройки клиники: реквизиты организации, коэффициенты наценок, нормы времени и глобальные системные коэффициенты",
          "permissions": ["sysadmin", "accountant"]
        },
        {
          "id": "fiscal_settings",
          "text": "Параметры фискального регистратора «АТОЛ 91Ф»",
          "path": "/admin/fiscal-settings",
          "icon": "Tune",
          "tooltip": "Конфигурация фискального регистратора: управление профилями подключения, COM-портом, скоростью обмена и параметрами в базе SQLite",
          "permissions": ["sysadmin", "accountant"]
        },
        {
          "id": "pos_settings",
          "text": "Параметры POS Альфа-Банка",
          "path": "/admin/pos-settings",
          "icon": "CreditCard",
          "tooltip": "Конфигурация банковского POS-эквайринга: управление профилями подключения (IP/Port), параметрами терминала и режимом эмуляции",
          "permissions": ["sysadmin", "accountant"]
        }
      ]
    },
    {
      "id": "base_entities",
      "title": "Базовые данные",
      "icon": "FolderSpecial",
      "defaultOpen": false,
      "tooltip": "Нормативно-справочная информация (НСИ): картотека пациентов клиники и электронные медицинские карты",
      "permissions": ["sysadmin", "administrator", "doctor", "nurse"],
      "items": [
        {
          "id": "patients",
          "text": "Пациенты (ЭМК картотека)",
          "path": "/patients",
          "icon": "People",
          "tooltip": "Электронная медицинская карта (ЭМК): реестр пациентов клиники, паспортные данные, контакты, история визитов и прикрепленные файлы",
          "permissions": ["sysadmin", "administrator", "doctor", "nurse"]
        }
      ]
    },
    {
      "id": "bi",
      "title": "Аналитика",
      "icon": "BarChart",
      "defaultOpen": false,
      "tooltip": "Управленческая и финансовая аналитика: BI дашборды, маржинальный анализ услуг, доходы и расходы клиники",
      "permissions": ["*"],
      "items": [
        {
          "id": "dashboard",
          "text": "BI Дашборд",
          "path": "/",
          "icon": "Dashboard",
          "tooltip": "Главный экран аналитики: оперативные KPI клиники, динамика выручки, загрузка кабинетов и агрегированные финансовые метрики",